File /home/arthur2ee/Descargas/Lenovo_Ideapad_320-14ISK_BIOS-UEFI_HAP-Enabled_Backup-2.bin is 8388608 bytes
PCH Revision: 100/200 series Sunrise Point
FLMAP0:    0x00040003
  FRBA:    0x40
  NC:      1
  FCBA:    0x30
FLMAP1:    0x42100208
  PSL:     0x42
  FPSBA:   0x100
  NM:      2
  FMBA:    0x80
FLUMAP1:   0x000012df
  Intel ME VSCC Table Length (VTL):        18
  Intel ME VSCC Table Base Address (VTBA): 0x000df0

ME VSCC table:
  JID0:  0x0000471f
    SPI Component Vendor ID:            0x1f
    SPI Component Device ID 0:          0x47
    SPI Component Device ID 1:          0x00
  VSCC0: 0x20152015
    Lower Erase Opcode:                 0x20
    Lower Write Enable on Write Status: 0x06
    Lower Write Status Required:        No
    Lower Write Granularity:            64 bytes
    Lower Block / Sector Erase Size:    4KB
    Upper Erase Opcode:                 0x20
    Upper Write Enable on Write Status: 0x06
    Upper Write Status Required:        No
    Upper Write Granularity:            64 bytes
    Upper Block / Sector Erase Size:    4KB
  JID1:  0x001740ef
    SPI Component Vendor ID:            0xef
    SPI Component Device ID 0:          0x40
    SPI Component Device ID 1:          0x17
  VSCC1: 0x20252025
    Lower Erase Opcode:                 0x20
    Lower Write Enable on Write Status: 0x50
    Lower Write Status Required:        No
    Lower Write Granularity:            64 bytes
    Lower Block / Sector Erase Size:    4KB
    Upper Erase Opcode:                 0x20
    Upper Write Enable on Write Status: 0x50
    Upper Write Status Required:        No
    Upper Write Granularity:            64 bytes
    Upper Block / Sector Erase Size:    4KB
  JID2:  0x001740c8
    SPI Component Vendor ID:            0xc8
    SPI Component Device ID 0:          0x40
    SPI Component Device ID 1:          0x17
  VSCC2: 0x20252025
    Lower Erase Opcode:                 0x20
    Lower Write Enable on Write Status: 0x50
    Lower Write Status Required:        No
    Lower Write Granularity:            64 bytes
    Lower Block / Sector Erase Size:    4KB
    Upper Erase Opcode:                 0x20
    Upper Write Enable on Write Status: 0x50
    Upper Write Status Required:        No
    Upper Write Granularity:            64 bytes
    Upper Block / Sector Erase Size:    4KB
  JID3:  0x001720c2
    SPI Component Vendor ID:            0xc2
    SPI Component Device ID 0:          0x20
    SPI Component Device ID 1:          0x17
  VSCC3: 0x20452045
    Lower Erase Opcode:                 0x20
    Lower Write Enable on Write Status: 0x50
    Lower Write Status Required:        No
    Lower Write Granularity:            64 bytes
    Lower Block / Sector Erase Size:    4KB
    Upper Erase Opcode:                 0x20
    Upper Write Enable on Write Status: 0x50
    Upper Write Status Required:        No
    Upper Write Granularity:            64 bytes
    Upper Block / Sector Erase Size:    4KB
  JID4:  0x0017701c
    SPI Component Vendor ID:            0x1c
    SPI Component Device ID 0:          0x70
    SPI Component Device ID 1:          0x17
  VSCC4: 0x20052005
    Lower Erase Opcode:                 0x20
    Lower Write Enable on Write Status: 0x50
    Lower Write Status Required:        No
    Lower Write Granularity:            64 bytes
    Lower Block / Sector Erase Size:    4KB
    Upper Erase Opcode:                 0x20
    Upper Write Enable on Write Status: 0x50
    Upper Write Status Required:        No
    Upper Write Granularity:            64 bytes
    Upper Block / Sector Erase Size:    4KB
  JID5:  0x0017ba20
    SPI Component Vendor ID:            0x20
    SPI Component Device ID 0:          0xba
    SPI Component Device ID 1:          0x17
  VSCC5: 0x20052005
    Lower Erase Opcode:                 0x20
    Lower Write Enable on Write Status: 0x50
    Lower Write Status Required:        No
    Lower Write Granularity:            64 bytes
    Lower Block / Sector Erase Size:    4KB
    Upper Erase Opcode:                 0x20
    Upper Write Enable on Write Status: 0x50
    Upper Write Status Required:        No
    Upper Write Granularity:            64 bytes
    Upper Block / Sector Erase Size:    4KB
  JID6:  0x001740ef
    SPI Component Vendor ID:            0xef
    SPI Component Device ID 0:          0x40
    SPI Component Device ID 1:          0x17
  VSCC6: 0x20252025
    Lower Erase Opcode:                 0x20
    Lower Write Enable on Write Status: 0x50
    Lower Write Status Required:        No
    Lower Write Granularity:            64 bytes
    Lower Block / Sector Erase Size:    4KB
    Upper Erase Opcode:                 0x20
    Upper Write Enable on Write Status: 0x50
    Upper Write Status Required:        No
    Upper Write Granularity:            64 bytes
    Upper Block / Sector Erase Size:    4KB
  JID7:  0x001740c8
    SPI Component Vendor ID:            0xc8
    SPI Component Device ID 0:          0x40
    SPI Component Device ID 1:          0x17
  VSCC7: 0x20252025
    Lower Erase Opcode:                 0x20
    Lower Write Enable on Write Status: 0x50
    Lower Write Status Required:        No
    Lower Write Granularity:            64 bytes
    Lower Block / Sector Erase Size:    4KB
    Upper Erase Opcode:                 0x20
    Upper Write Enable on Write Status: 0x50
    Upper Write Status Required:        No
    Upper Write Granularity:            64 bytes
    Upper Block / Sector Erase Size:    4KB

OEM Section:
00: ff ff ff ff ff ff ff ff ff ff ff ff ff ff ff ff
10: ff ff ff ff ff ff ff ff ff ff ff ff ff ff ff ff
20: ff ff ff ff ff ff ff ff ff ff ff ff ff ff ff ff
30: ff ff ff ff ff ff ff ff ff ff ff ff ff ff ff ff

Found Region Section
FLREG0:    0x00000000
  Flash Region 0 (Flash Descriptor): 00000000 - 00000fff 
FLREG1:    0x07ff0210
  Flash Region 1 (BIOS): 00210000 - 007fffff 
FLREG2:    0x020f0001
  Flash Region 2 (Intel ME): 00001000 - 0020ffff 
FLREG3:    0x00007fff
  Flash Region 3 (GbE): 07fff000 - 00000fff (unused)
FLREG4:    0x00007fff
  Flash Region 4 (Platform Data): 07fff000 - 00000fff (unused)
FLREG5:    0x00007fff
  Flash Region 5 (Device Exp1): 07fff000 - 00000fff (unused)
FLREG6:    0x00007fff
  Flash Region 6 (Secondary BIOS): 07fff000 - 00000fff (unused)
FLREG8:    0x00007fff
  Flash Region 8 (EC): 07fff000 - 00000fff (unused)
FLREG9:    0x00007fff
  Flash Region 9 (Device Exp2): 07fff000 - 00000fff (unused)
FLREG10:    0xffffffff
  Flash Region 10 (IE): 07fff000 - 07ffffff 
FLREG11:    0xffffffff
  Flash Region 11 (10GbE_0): 07fff000 - 07ffffff 
FLREG12:    0xffffffff
  Flash Region 12 (10GbE_1): 07fff000 - 07ffffff 
FLREG13:    0xffffffff
  Flash Region 13 (Reserved): 07fff000 - 07ffffff 
FLREG14:    0xffffffff
  Flash Region 14 (Reserved): 07fff000 - 07ffffff 
FLREG15:    0xffffffff
  Flash Region 15 (PTT): 07fff000 - 07ffffff 

Found Component Section
FLCOMP     0x365c00f4
  Dual Output Fast Read Support:       not supported
  Read ID/Read Status Clock Frequency: 17MHz
  Write/Erase Clock Frequency:         17MHz
  Fast Read Clock Frequency:           48MHz
  Fast Read Support:                   supported
  Read Clock Frequency:                17MHz
  Component 2 Density:                 UNUSED
  Component 1 Density:                 8MB
FLILL      0xad604221
  Invalid Instruction 3: 0xad
  Invalid Instruction 2: 0x60
  Invalid Instruction 1: 0x42
  Invalid Instruction 0: 0x21
FLILL1     0xc7c4b9b7
  Invalid Instruction 7: 0xc7
  Invalid Instruction 6: 0xc4
  Invalid Instruction 5: 0xb9
  Invalid Instruction 4: 0xb7
Found PCH Strap Section
PCHSTRP0  : 0x00010000
PCHSTRP1  : 0x00000100
PCHSTRP2  : 0x00000000
PCHSTRP3  : 0x00000000
PCHSTRP4  : 0x00000000
PCHSTRP5  : 0x00010000
PCHSTRP6  : 0x00000000
PCHSTRP7  : 0x00000000
PCHSTRP8  : 0x00000000
PCHSTRP9  : 0x00000000
PCHSTRP10 : 0x00030000
PCHSTRP11 : 0x00000100
PCHSTRP12 : 0x00000000
PCHSTRP13 : 0x00000000
PCHSTRP14 : 0x00000000
PCHSTRP15 : 0x00010000
PCHSTRP16 : 0x00000000
PCHSTRP17 : 0x00000070
PCHSTRP18 : 0x00000203
PCHSTRP19 : 0x00000064
PCHSTRP20 : 0x00000000
PCHSTRP21 : 0x00003a25
PCHSTRP22 : 0x00000002
PCHSTRP23 : 0x00000008
PCHSTRP24 : 0x00000030
PCHSTRP25 : 0x00000020
PCHSTRP26 : 0x00000010
PCHSTRP27 : 0x00050000
PCHSTRP28 : 0x00000000
PCHSTRP29 : 0x0000000e
PCHSTRP30 : 0x00000000
PCHSTRP31 : 0x00001014
PCHSTRP32 : 0x00050001
PCHSTRP33 : 0x00000003
PCHSTRP34 : 0x00000000
PCHSTRP35 : 0x00001550
PCHSTRP36 : 0xff08f091
PCHSTRP37 : 0xfcfcfcf7
PCHSTRP38 : 0x00000000
PCHSTRP39 : 0x00001800
PCHSTRP40 : 0x00000000
PCHSTRP41 : 0x00000000
PCHSTRP42 : 0x00000000
PCHSTRP43 : 0x00001c00
PCHSTRP44 : 0x00000000
PCHSTRP45 : 0x00000047
PCHSTRP46 : 0x00000030
PCHSTRP47 : 0x0000033f
PCHSTRP48 : 0x00000099
PCHSTRP49 : 0x00000012
PCHSTRP50 : 0x02640000
PCHSTRP51 : 0x00000000
PCHSTRP52 : 0x0961f400
PCHSTRP53 : 0x00000019
PCHSTRP54 : 0x55555579
PCHSTRP55 : 0x0000011f
PCHSTRP56 : 0x0a010703
PCHSTRP57 : 0x00000200
PCHSTRP58 : 0x020f0009
PCHSTRP59 : 0x00ff0000
PCHSTRP60 : 0x00000001
PCHSTRP61 : 0x00008645
PCHSTRP62 : 0x00000000
PCHSTRP63 : 0x00000f27
PCHSTRP64 : 0x00400000
PCHSTRP65 : 0x000432f4
HAP bit is set

Found Master Section
FLMSTR1:   0x00a00b00 (Host CPU/BIOS)
  EC Region Write Access:            disabled
  Platform Data Region Write Access: disabled
  GbE Region Write Access:           enabled
  Intel ME Region Write Access:      disabled
  Host CPU/BIOS Region Write Access: enabled
  Flash Descriptor Write Access:     disabled
  EC Region Read Access:             disabled
  Platform Data Region Read Access:  disabled
  GbE Region Read Access:            enabled
  Intel ME Region Read Access:       disabled
  Host CPU/BIOS Region Read Access:  enabled
  Flash Descriptor Read Access:      enabled
FLMSTR2:   0x00c00d00 (Intel ME)
  EC Region Write Access:            disabled
  Platform Data Region Write Access: disabled
  GbE Region Write Access:           enabled
  Intel ME Region Write Access:      enabled
  Host CPU/BIOS Region Write Access: disabled
  Flash Descriptor Write Access:     disabled
  EC Region Read Access:             disabled
  Platform Data Region Read Access:  disabled
  GbE Region Read Access:            enabled
  Intel ME Region Read Access:       enabled
  Host CPU/BIOS Region Read Access:  disabled
  Flash Descriptor Read Access:      enabled
FLMSTR3:   0x00800900 (GbE)
  EC Region Write Access:            disabled
  Platform Data Region Write Access: disabled
  GbE Region Write Access:           enabled
  Intel ME Region Write Access:      disabled
  Host CPU/BIOS Region Write Access: disabled
  Flash Descriptor Write Access:     disabled
  EC Region Read Access:             disabled
  Platform Data Region Read Access:  disabled
  GbE Region Read Access:            enabled
  Intel ME Region Read Access:       disabled
  Host CPU/BIOS Region Read Access:  disabled
  Flash Descriptor Read Access:      enabled
FLMSTR5:   0x10010300 (EC)
  EC Region Write Access:            enabled
  Platform Data Region Write Access: disabled
  GbE Region Write Access:           disabled
  Intel ME Region Write Access:      disabled
  Host CPU/BIOS Region Write Access: disabled
  Flash Descriptor Write Access:     disabled
  EC Region Read Access:             enabled
  Platform Data Region Read Access:  disabled
  GbE Region Read Access:            disabled
  Intel ME Region Read Access:       disabled
  Host CPU/BIOS Region Read Access:  enabled
  Flash Descriptor Read Access:      enabled
Found Processor Strap Section
????:      0x00001000
????:      0x00108002
????:      0x00000210
????:      0xffffffff
????:      0xffffffff
????:      0xffffffff
????:      0xffffffff
????:      0xffffffff
